repayment,"One-year repayment rate by family income ($75,000+)",1_yr_repayment.income.greater_than_75000,float,HI_INC_RPY_1YR_RT,(blank),(blank),NSLDS,(blank)
repayment,One-year repayment rate for completers,1_yr_repayment.completers_rate,float,COMPL_RPY_1YR_RT,(blank),(blank),NSLDS,(blank)
repayment,One-year repayment rate for dependent students,1_yr_repayment.dependent_students_rate,float,DEP_RPY_1YR_RT,(blank),(blank),NSLDS,(blank)
repayment,One-year repayment rate for females,1_yr_repayment.female_students_rate,float,FEMALE_RPY_1YR_RT,(blank),(blank),NSLDS,(blank)
repayment,One-year repayment rate for first-generation students,1_yr_repayment.first_generation_students_rate,float,FIRSTGEN_RPY_1YR_RT,(blank),(blank),NSLDS,(blank)
repayment,One-year repayment rate for independent students,1_yr_repayment.independent_students_rate,float,IND_RPY_1YR_RT,(blank),(blank),NSLDS,(blank)
repayment,One-year repayment rate for males,1_yr_repayment.male_students_rate,float,MALE_RPY_1YR_RT,(blank),(blank),NSLDS,(blank)
repayment,One-year repayment rate for non-completers,1_yr_repayment.noncompleters_rate,float,NONCOM_RPY_1YR_RT,(blank),(blank),NSLDS,(blank)
repayment,One-year repayment rate for students who are not first-generation,1_yr_repayment.non_first_generation_students_rate,float,NOTFIRSTGEN_RPY_1YR_RT,(blank),(blank),NSLDS,(blank)
repayment,One-year repayment rate for students who never received a Pell grant while at school,1_yr_repayment.no_pell_grant_rate,float,NOPELL_RPY_1YR_RT,(blank),(blank),NSLDS,(blank)
repayment,One-year repayment rate for students who received a Pell grant while at the school,1_yr_repayment.pell_grant_rate,float,PELL_RPY_1YR_RT,(blank),(blank),NSLDS,(blank)
repayment,"Seven-year repayment rate by family income ($0-30,000)",7_yr_repayment.income.0_30000,float,LO_INC_RPY_7YR_RT,(blank),(blank),NSLDS,(blank)
repayment,"Seven-year repayment rate by family income ($30,000-75,000)",7_yr_repayment.income.30000_75000,float,MD_INC_RPY_7YR_RT,(blank),(blank),NSLDS,(blank)
repayment,"Seven-year repayment rate by family income ($75,000+)",7_yr_repayment.income.greater_than_75000,float,HI_INC_RPY_7YR_RT,(blank),(blank),NSLDS,(blank)
repayment,Seven-year repayment rate for completers,7_yr_repayment.completers_rate,float,COMPL_RPY_7YR_RT,(blank),(blank),NSLDS,(blank)
repayment,Seven-year repayment rate for dependent students,7_yr_repayment.dependent_students_rate,float,DEP_RPY_7YR_RT,(blank),(blank),NSLDS,(blank)
repayment,Seven-year repayment rate for females,7_yr_repayment.female_students_rate,float,FEMALE_RPY_7YR_RT,(blank),(blank),NSLDS,(blank)
repayment,Seven-year repayment rate for first-generation students,7_yr_repayment.first_generation_students_rate,float,FIRSTGEN_RPY_7YR_RT,(blank),(blank),NSLDS,(blank)
repayment,Seven-year repayment rate for independent students,7_yr_repayment.independent_students_rate,float,IND_RPY_7YR_RT,(blank),(blank),NSLDS,(blank)
repayment,Seven-year repayment rate for males,7_yr_repayment.male_students_rate,float,MALE_RPY_7YR_RT,(blank),(blank),NSLDS,(blank)
repayment,Seven-year repayment rate for non-completers,7_yr_repayment.noncompleters_rate,float,NONCOM_RPY_7YR_RT,(blank),(blank),NSLDS,(blank)
repayment,Seven-year repayment rate for students who are not first-generation,7_yr_repayment.non_first_generation_students_rate,float,NOTFIRSTGEN_RPY_7YR_RT,(blank),(blank),NSLDS,(blank)
repayment,Seven-year repayment rate for students who never received a Pell grant while at school,7_yr_repayment.no_pell_grant_rate,float,NOPELL_RPY_7YR_RT,(blank),(blank),NSLDS,(blank)
repayment,Seven-year repayment rate for students who received a Pell grant while at the school,7_yr_repayment.pell_grant_rate,float,PELL_RPY_7YR_RT,(blank),(blank),NSLDS,(blank)
repayment,"Three-year repayment rate by family income ($0-30,000)",3_yr_repayment.income.0_30000,float,LO_INC_RPY_3YR_RT,(blank),(blank),NSLDS,(blank)
repayment,"Three-year repayment rate by family income ($30,000-75,000)",3_yr_repayment.income.30000_75000,float,MD_INC_RPY_3YR_RT,(blank),(blank),NSLDS,(blank)
repayment,"Three-year repayment rate by family income ($75,000+)",3_yr_repayment.income.greater_than_75000,float,HI_INC_RPY_3YR_RT,(blank),(blank),NSLDS,(blank)
repayment,Three-year repayment rate for completers,3_yr_repayment.completers_rate,float,COMPL_RPY_3YR_RT,(blank),(blank),NSLDS,(blank)
repayment,Three-year repayment rate for dependent students,3_yr_repayment.dependent_students_rate,float,DEP_RPY_3YR_RT,(blank),(blank),NSLDS,(blank)
repayment,Three-year repayment rate for females,3_yr_repayment.female_students_rate,float,FEMALE_RPY_3YR_RT,(blank),(blank),NSLDS,(blank)
repayment,Three-year repayment rate for first-generation students,3_yr_repayment.first_generation_students_rate,float,FIRSTGEN_RPY_3YR_RT,(blank),(blank),NSLDS,(blank)
repayment,Three-year repayment rate for independent students,3_yr_repayment.independent_students_rate,float,IND_RPY_3YR_RT,(blank),(blank),NSLDS,(blank)
repayment,Three-year repayment rate for males,3_yr_repayment.male_students_rate,float,MALE_RPY_3YR_RT,(blank),(blank),NSLDS,(blank)
repayment,Three-year repayment rate for non-completers,3_yr_repayment.noncompleters_rate,float,NONCOM_RPY_3YR_RT,(blank),(blank),NSLDS,(blank)
repayment,Three-year repayment rate for students who are not first-generation,3_yr_repayment.non_first_generation_students_rate,float,NOTFIRSTGEN_RPY_3YR_RT,(blank),(blank),NSLDS,(blank)
repayment,Three-year repayment rate for students who never received a Pell grant while at school,3_yr_repayment.no_pell_grant_rate,float,NOPELL_RPY_3YR_RT,(blank),(blank),NSLDS,(blank)
repayment,Three-year repayment rate for students who received a Pell grant while at the school,3_yr_repayment.pell_grant_rate,float,PELL_RPY_3YR_RT,(blank),(blank),NSLDS,(blank)
root,6-digit OPE ID for institution,ope6_id,string,OPEID6,(blank),(blank),IPEDS,Shown/used on consumer website.
root,8-digit OPE ID for institution,ope8_id,string,OPEID,(blank),(blank),IPEDS,Shown/used on consumer website.
root,Latitude,location.lat,float,LATITUDE,(blank),(blank),IPEDS,(blank)
root,Longitude,location.lon,float,LONGITUDE,(blank),(blank),IPEDS,(blank)
root,Unit ID for institution,id,integer,UNITID,(blank),(blank),IPEDS,Shown/used on consumer website.
school,Average faculty salary,faculty_salary,integer,AVGFACSAL,(blank),(blank),IPEDS,"Average faculty salary per month, calculated from the IPEDS Human Resources component. This metric is calculated as the total salary outlays divided by the number of months worked for all full-time nonmedical instructional staff. Prior to the 2011-12 academic year, when months worked were reported in groups, the value for 9-10 months is estimated as 9.5 months and the value for 11-12 months is estimated as 11.5 months. Values prior to the 2003-04 academic year are limited to degree-granting institutions for consistency with values in subsequent academic years."
school,Carnegie Classification -- basic,carnegie_basic,integer,CCBASIC,-2,Not applicable,IPEDS,(blank)
school,Carnegie Classification -- size and setting,carnegie_size_setting,integer,CCSIZSET,-2,Not applicable,IPEDS,(blank)
school,Carnegie Classification -- undergraduate profile,carnegie_undergrad,integer,CCUGPROF,-2,Not applicable,IPEDS,(blank)
school,City,city,autocomplete,CITY,(blank),(blank),IPEDS,Shown/used on consumer website.
school,Control of institution,ownership,integer,CONTROL,1,Public,IPEDS,Shown/used on consumer website.
school,"Control of institution, per PEPS",ownership_peps,integer,SCHTYPE,1,Public            ,FSA,(blank)
school,Degree of urbanization of institution,degree_urbanization,integer,LOCALE2,1,"Large City (a central city of a CMSA or MSA, with the city having a population greater than or equal to 250,000)",IPEDS,(blank)
school,FIPS code for state,state_fips,integer,ST_FIPS,1,Alabama,IPEDS,(blank)
school,"Flag for currently operating institution, 0=closed, 1=operating",operating,integer,CURROPER,0,Not currently certified as an operating institution,FSA,Shown/used on consumer website.
school,Flag for distance-education-only education,online_only,integer,DISTANCEONLY,0,Not distance-education only,IPEDS,Shown/used on consumer website.
school,Flag for main campus,main_campus,integer,MAIN,0,Not main campus,IPEDS,(blank)
school,Flag for men-only college,men_only,integer,MENONLY,0,No,IPEDS,Shown/used on consumer website.
school,Flag for women-only college,women_only,integer,WOMENONLY,0,No,IPEDS,Shown/used on consumer website.
school,Institution name,name,autocomplete,INSTNM,(blank),(blank),IPEDS,Shown/used on consumer website.
school,Instructional expenditures per full-time equivalent student,instructional_expenditure_per_fte,integer,INEXPFTE,(blank),(blank),IPEDS,Instructional expenditures divided by the number of FTE students (undergraduates and graduate students) (http://nces.ed.gov/ipeds/glossary/index.asp?id=854). Instructional expenditures are included in the IPEDS Finance component and FTE enrollment is included in the IPEDS 12-Month Enrollment component. This metric includes graduate students.
school,Locale of institution,locale,integer,LOCALE,11,"City: Large (population of 250,000 or more)",IPEDS,Shown/used on consumer website.
school,Net tuition revenue per full-time equivalent student,tuition_revenue_per_fte,integer,TUITFTE,(blank),(blank),IPEDS,Net tuition revenue (tuition revenue minus discounts and allowances) divided by the number of FTE students (undergraduates and graduate students) (http://nces.ed.gov/ipeds/glossary/index.asp?id=854). Net tuition revenue is included in the IPEDS Finance component and FTE enrollment is included in the IPEDS 12-Month Enrollment component. This metric includes graduate students.
school,Number of branch campuses,branches,integer,NUMBRANCH,(blank),(blank),IPEDS,(blank)
school,Predominant degree awarded (recoded 0s and 4s),degrees_awarded.predominant_recoded,integer,SCH_DEG,(blank),(blank),IPEDS/NSLDS,"Missing values, 0s, and 4s from PREDDEG recoded according to NSLDS program length"
school,"Predominant undergraduate degree awarded
 0 Not classified
 1 Predominantly certificate-degree granting
 2 Predominantly associate's-degree granting
 3 Predominantly bachelor's-degree granting
 4 Entirely graduate-degree granting",degrees_awarded.predominant,integer,PREDDEG,0,Not classified,IPEDS,Shown/used on consumer website.
school,Proportion of faculty that is full-time,ft_faculty_rate,float,PFTFAC,(blank),(blank),IPEDS,"Proportion of faculty that are employed full time, calculated from the IPEDS Human Resources component. This metric is calculated as the number of full-time nonmedical faculty divided by the total number of nonmedical faculty. Proportions are expressed as decimals rounded to four decimal places, so, for example, 0.1234 equals 12.34 percent."
school,Region (IPEDS),region_id,integer,REGION,0,U.S. Service Schools,IPEDS,(blank)
school,State postcode,state,string,STABBR,(blank),(blank),IPEDS,Shown/used on consumer website.
school,URL for institution's homepage,school_url,string,INSTURL,(blank),(blank),IPEDS,Shown/used on consumer website.
school,ZIP code,zip,string,ZIP,(blank),(blank),IPEDS,(blank)
student,"Aided students with family incomes between $110,001+ in nominal dollars",share_highincome.110001plus,float,INC_PCT_H2,(blank),(blank),NSLDS,(blank)
student,"Aided students with family incomes between $30,001-$48,000 in nominal dollars",share_middleincome.30001_48000,float,INC_PCT_M1,(blank),(blank),NSLDS,(blank)
student,"Aided students with family incomes between $48,001-$75,000 in nominal dollars",share_middleincome.48001_75000,float,INC_PCT_M2,(blank),(blank),NSLDS,(blank)
student,"Aided students with family incomes between $75,001-$110,000 in nominal dollars",share_highincome.75001_110000,float,INC_PCT_H1,(blank),(blank),NSLDS,(blank)
student,Average age of entry,demographics.age_entry,integer,AGE_ENTRY,(blank),(blank),Treasury,Data element describes the earnings cohort (without exclusions for military and in-school deferments in the measurement year)
student,Average family income for independent students in real 2015 dollars,demographics.avg_family_income_independents,integer,FAMINC_IND,(blank),(blank),NSLDS,Data element describes the earnings cohort (without exclusions for military and in-school deferments in the measurement year)
student,Average family income in real 2015 dollars,demographics.avg_family_income,integer,FAMINC,(blank),(blank),NSLDS,Data element describes the earnings cohort (without exclusions for military and in-school deferments in the measurement year)
student,Average of the age of entry squared,demographics.age_entry_squared,integer,AGE_ENTRY_SQ,(blank),(blank),Treasury,Data element describes the earnings cohort (without exclusions for military and in-school deferments in the measurement year)
student,Average of the log of family income,demographics.avg_family_income_log,integer,LNFAMINC,(blank),(blank),Treasury,Data element describes the earnings cohort (without exclusions for military and in-school deferments in the measurement year)
student,Average of the log of family income for independent students,demographics.avg_family_income_independents_log,integer,LNFAMINC_IND,(blank),(blank),Treasury,Data element describes the earnings cohort (without exclusions for military and in-school deferments in the measurement year)
student,"Dependent students with family incomes between $110,001+ in nominal dollars",share_dependent_highincome.110001plus,float,DEP_INC_PCT_H2,(blank),(blank),NSLDS,(blank)
student,"Dependent students with family incomes between $30,001-$48,000 in nominal dollars",share_dependent_middleincome.300001_48000,float,DEP_INC_PCT_M1,(blank),(blank),NSLDS,(blank)
student,"Dependent students with family incomes between $48,001-$75,000 in nominal dollars",share_dependent_middleincome.48001_75000,float,DEP_INC_PCT_M2,(blank),(blank),NSLDS,(blank)
student,"Dependent students with family incomes between $75,001-$110,000 in nominal dollars",share_dependent_highincome.75001_110000,float,DEP_INC_PCT_H1,(blank),(blank),NSLDS,(blank)
student,Enrollment of all undergraduate students,enrollment.all,integer,UG,(blank),(blank),IPEDS,Available in 2000-2001 datafile only
student,Enrollment of undergraduate certificate/degree-seeking students,size,integer,UGDS,(blank),(blank),IPEDS,Shown/used on consumer website;    Not available in 2000-2001 datafile
student,"Independent students with family incomes between $110,001+ in nominal dollars",share_independent_highincome.110001plus,float,IND_INC_PCT_H2,(blank),(blank),NSLDS,(blank)
student,"Independent students with family incomes between $30,001-$48,000 in nominal dollars",share_independent_middleincome.30001_48000,float,IND_INC_PCT_M1,(blank),(blank),NSLDS,(blank)
student,"Independent students with family incomes between $48,001-$75,000 in nominal dollars",share_independent_middleincome.48001_75000,float,IND_INC_PCT_M2,(blank),(blank),NSLDS,(blank)
student,"Independent students with family incomes between $75,001-$110,000 in nominal dollars",share_independent_highincome.75001_110000,float,IND_INC_PCT_H1,(blank),(blank),NSLDS,(blank)
student,Median family income in real 2015 dollars,demographics.median_family_income,integer,MD_FAMINC,(blank),(blank),NSLDS,Data element describes the earnings cohort (without exclusions for military and in-school deferments in the measurement year)
student,"Number of full-time, first-time degree/certificate-seeking undergraduate students (denominator for percent full-time, first-time degree/certificate-seeking undergraduates receiving a pell grant or federal student loan), pooled in rolling averages",ftft_undergrads_with_pell_grant_or_federal_student_loan_pooled,integer,SCUGFFN_POOLED,(blank),(blank),IPEDS,(blank)
student,Percent of students over 23 at entry,demographics.over_23_at_entry,float,AGEGE24,(blank),(blank),NSLDS,Data element describes the earnings cohort (without exclusions for military and in-school deferments in the measurement year)
student,Percentage of undergraduates aged 25 and above,share_25_older,float,UG25ABV,(blank),(blank),IPEDS,The proportion of undergraduates who are aged 25 or older
student,Share of dependent students,demographics.dependent,float,DEPENDENT,(blank),(blank),NSLDS,Data element describes the earnings cohort (without exclusions for military and in-school deferments in the measurement year)
student,Share of female students,demographics.female_share,float,FEMALE,(blank),(blank),NSLDS,Data element describes the earnings cohort (without exclusions for military and in-school deferments in the measurement year)
student,Share of first-generation students,demographics.first_generation,float,FIRST_GEN,(blank),(blank),NSLDS,Data element describes the earnings cohort (without exclusions for military and in-school deferments in the measurement year)
student,Share of married students,demographics.married,float,MARRIED,(blank),(blank),NSLDS,Data element describes the earnings cohort (without exclusions for military and in-school deferments in the measurement year)
student,Share of students who received a Pell Grant while in school,students_with_pell_grant,float,PELL_EVER,(blank),(blank),NSLDS,Data element describes the earnings cohort (without exclusions for military and in-school deferments in the measurement year)
student,"Share of undergraduate, degree-/certificate-seeking students who are part-time",part_time_share,float,PPTUG_EF,(blank),(blank),IPEDS,"Shown/used on consumer website;    The proportion of degree/certificate-seeking undergraduates enrolled part time in the fall term, calculated from the IPEDS Fall Enrollment component. This metric does not apply during 2000-01, when degree/certificate-seeking status was not collected. It is calculated as the number of part-time, degree/certificate-seeking undergraduates divided by the total number of degree/certificate-seeking undergraduates. It includes non-first-time undergraduates. Proportions are expressed as decimals rounded to four decimal places, so, for example, 0.1234 equals 12.34 percent."
student,"Share of undergraduate, degree-/certificate-seeking students who are part-time",part_time_share_2000,float,PPTUG_EF2,(blank),(blank),IPEDS,"The proportion of all undergraduates enrolled part time in the fall term, calculated from the IPEDS Fall Enrollment component. This metric only applies during 2000-01, when degree/certificate-seeking status was not collected. It is calculated as the number of part-time undergraduates divided by the total number of undergraduates. It includes non-first-time undergraduates. Proportions are expressed as decimals rounded to four decimal places, so, for example, 0.1234 equals 12.34 percent."
student,Share of veteran students,demographics.veteran,float,VETERAN,(blank),(blank),NSLDS,Data element describes the earnings cohort (without exclusions for military and in-school deferments in the measurement year)
student,Total share of enrollment of undergraduate degree-seeking students who are American Indian/Alaska Native,demographics.race_ethnicity.aian,float,UGDS_AIAN,(blank),(blank),IPEDS,Shown/used on consumer website;    Not available in all datafiles due to changing race/ethnicity category definitions over time. See data_cohort_map
student,Total share of enrollment of undergraduate degree-seeking students who are American Indian/Alaska Native,demographics.race_ethnicity.aian_prior_2009,float,UGDS_AIANOLD,(blank),(blank),IPEDS,Not available in all datafiles due to changing race/ethnicity category definitions over time. See data_cohort_map
student,Total share of enrollment of undergraduate degree-seeking students who are Asian,demographics.race_ethnicity.asian,float,UGDS_ASIAN,(blank),(blank),IPEDS,Shown/used on consumer website;    Not available in all datafiles due to changing race/ethnicity category definitions over time. See data_cohort_map
student,Total share of enrollment of undergraduate degree-seeking students who are Asian/Pacific Islander,demographics.race_ethnicity.asian_pacific_islander,float,UGDS_API,(blank),(blank),IPEDS,Not available in all datafiles due to changing race/ethnicity category definitions over time. See data_cohort_map
student,Total share of enrollment of undergraduate degree-seeking students who are black,demographics.race_ethnicity.black,float,UGDS_BLACK,(blank),(blank),IPEDS,Shown/used on consumer website;    Not available in all datafiles due to changing race/ethnicity category definitions over time. See data_cohort_map
student,Total share of enrollment of undergraduate degree-seeking students who are black non-Hispanic,demographics.race_ethnicity.black_non_hispanic,float,UGDS_BLACKNH,(blank),(blank),IPEDS,Not available in all datafiles due to changing race/ethnicity category definitions over time. See data_cohort_map
student,Total share of enrollment of undergraduate degree-seeking students who are Hispanic,demographics.race_ethnicity.hispanic,float,UGDS_HISP,(blank),(blank),IPEDS,Shown/used on consumer website;    Not available in all datafiles due to changing race/ethnicity category definitions over time. See data_cohort_map
student,Total share of enrollment of undergraduate degree-seeking students who are Hispanic,demographics.race_ethnicity.hispanic_prior_2009,float,UGDS_HISPOLD,(blank),(blank),IPEDS,Not available in all datafiles due to changing race/ethnicity category definitions over time. See data_cohort_map
student,Total share of enrollment of undergraduate degree-seeking students who are Native Hawaiian/Pacific Islander,demographics.race_ethnicity.nhpi,float,UGDS_NHPI,(blank),(blank),IPEDS,Shown/used on consumer website;    Not available in all datafiles due to changing race/ethnicity category definitions over time. See data_cohort_map
student,Total share of enrollment of undergraduate degree-seeking students who are non-resident aliens,demographics.race_ethnicity.non_resident_alien,float,UGDS_NRA,(blank),(blank),IPEDS,Shown/used on consumer website;    Not available in all datafiles due to changing race/ethnicity category definitions over time. See data_cohort_map
student,Total share of enrollment of undergraduate degree-seeking students who are two or more races,demographics.race_ethnicity.two_or_more,float,UGDS_2MOR,(blank),(blank),IPEDS,Shown/used on consumer website;    Not available in all datafiles due to changing race/ethnicity category definitions over time. See data_cohort_map
student,Total share of enrollment of undergraduate degree-seeking students who are white,demographics.race_ethnicity.white,float,UGDS_WHITE,(blank),(blank),IPEDS,Shown/used on consumer website;    Not available in all datafiles due to changing race/ethnicity category definitions over time. See data_cohort_map
student,Total share of enrollment of undergraduate degree-seeking students who are white non-Hispanic,demographics.race_ethnicity.white_non_hispanic,float,UGDS_WHITENH,(blank),(blank),IPEDS,Not available in all datafiles due to changing race/ethnicity category definitions over time. See data_cohort_map
student,Total share of enrollment of undergraduate degree-seeking students whose race is unknown,demographics.race_ethnicity.unknown,float,UGDS_UNKN,(blank),(blank),IPEDS,Shown/used on consumer website;    Not available in all datafiles due to changing race/ethnicity category definitions over time. See data_cohort_map
student,Total share of enrollment of undergraduate students who are American Indian/Alaska Native,demographics.race_ethnicity.aian_2000,float,UG_AIANOLD,(blank),(blank),IPEDS,Not available in all datafiles due to changing race/ethnicity category definitions over time. See data_cohort_map
student,Total share of enrollment of undergraduate students who are Asian/Pacific Islander,demographics.race_ethnicity.api_2000,float,UG_API,(blank),(blank),IPEDS,Not available in all datafiles due to changing race/ethnicity category definitions over time. See data_cohort_map
student,Total share of enrollment of undergraduate students who are black non-Hispanic,demographics.race_ethnicity.black_2000,float,UG_BLACKNH,(blank),(blank),IPEDS,Not available in all datafiles due to changing race/ethnicity category definitions over time. See data_cohort_map
student,Total share of enrollment of undergraduate students who are Hispanic,demographics.race_ethnicity.hispanic_2000,float,UG_HISPOLD,(blank),(blank),IPEDS,Not available in all datafiles due to changing race/ethnicity category definitions over time. See data_cohort_map
student,Total share of enrollment of undergraduate students who are non-resident aliens,demographics.non_resident_aliens_2000,float,UG_NRA,(blank),(blank),IPEDS,Not available in all datafiles due to changing race/ethnicity category definitions over time. See data_cohort_map
student,Total share of enrollment of undergraduate students who are white non-Hispanic,demographics.race_ethnicity.white_2000,float,UG_WHITENH,(blank),(blank),IPEDS,Not available in all datafiles due to changing race/ethnicity category definitions over time. See data_cohort_map
student,Total share of enrollment of undergraduate students whose race is unknown,demographics.race_ethnicity.unknown_2000,float,UG_UNKN,(blank),(blank),IPEDS,Not available in all datafiles due to changing race/ethnicity category definitions over time. See data_cohort_map
